{
  "schemaVersion": "1.0",
  "kind": "visual-machine-review-report",
  "fixtureSetId": "synthetic-visual-machine-review-v1",
  "fixtureKind": "synthetic_fixture",
  "sourceInventory": {
    "artifactRef": "eval/visual-machine-review/cases/visual-machine-review-case-inventory.json",
    "rawByteSha256": "c7fb1896ae679315311f88561a2c700b23c94d6fd15e992d9f5aabf4506c0a0f"
  },
  "caseReports": [
    {
      "caseId": "math-function-graph",
      "subjectPack": "math-answer",
      "reviewReceipt": {
        "artifactRef": "eval/visual-machine-review/cases/math-function-graph.visual-machine-review-receipt.json",
        "rawByteSha256": "52587ab4a455567fb6f0d6051439bf82cb4f34ac87fdd7d3f0590017a9ed8590"
      },
      "crop": {
        "artifactRef": "eval/visual-preprocessing/cases/math-function-graph.crop-2x.png",
        "rawByteSha256": "77911d7a23d34a664a907e596a421fd3fea575d53b191ee29c0030e773c66d92"
      },
      "decision": "accept_for_diagnostic_use",
      "limitationCount": 1,
      "metrics": {
        "reviewedCaseCount": 1,
        "acceptedCaseCount": 1,
        "rejectedCaseCount": 0,
        "limitedCaseCount": 1,
        "machineReviewedCount": 1,
        "humanReviewedCount": 0
      }
    },
    {
      "caseId": "junior-instrument-scale",
      "subjectPack": "junior-physics-answer",
      "reviewReceipt": {
        "artifactRef": "eval/visual-machine-review/cases/junior-instrument-scale.visual-machine-review-receipt.json",
        "rawByteSha256": "d80773d178317ce2493a1cef0a787f92b5b7233859c86cb8e1899fdf0ac7b058"
      },
      "crop": {
        "artifactRef": "eval/visual-preprocessing/cases/junior-instrument-scale.crop-2x.png",
        "rawByteSha256": "70577ca429dbc6afd5b2ecf536fe4712001bfddd961f9a041b103dca5fb8bb40"
      },
      "decision": "accept_for_diagnostic_use",
      "limitationCount": 1,
      "metrics": {
        "reviewedCaseCount": 1,
        "acceptedCaseCount": 1,
        "rejectedCaseCount": 0,
        "limitedCaseCount": 1,
        "machineReviewedCount": 1,
        "humanReviewedCount": 0
      }
    },
    {
      "caseId": "senior-circuit-label",
      "subjectPack": "senior-physics-answer",
      "reviewReceipt": {
        "artifactRef": "eval/visual-machine-review/cases/senior-circuit-label.visual-machine-review-receipt.json",
        "rawByteSha256": "54175da41aade93bb9200b469c4837dc5cac4927874b00e9a3d13242b55a8151"
      },
      "crop": {
        "artifactRef": "eval/visual-preprocessing/cases/senior-circuit-label.crop-2x.png",
        "rawByteSha256": "60854d32152030d5867875669073b73f320c1f67bd21c5fefc82b7f6114a316e"
      },
      "decision": "accept_for_diagnostic_use",
      "limitationCount": 1,
      "metrics": {
        "reviewedCaseCount": 1,
        "acceptedCaseCount": 1,
        "rejectedCaseCount": 0,
        "limitedCaseCount": 1,
        "machineReviewedCount": 1,
        "humanReviewedCount": 0
      }
    },
    {
      "caseId": "junior-readable-measurement",
      "subjectPack": "junior-physics-answer",
      "reviewReceipt": {
        "artifactRef": "eval/visual-machine-review/cases/junior-readable-measurement.visual-machine-review-receipt.json",
        "rawByteSha256": "1ea424a18707b1e2e86d41ecd913165d3cfb68c326a71722e7ab1aeba934dd1b"
      },
      "crop": {
        "artifactRef": "eval/visual-preprocessing/cases/junior-readable-measurement.crop-2x.png",
        "rawByteSha256": "619e236453646fdb4dfb772b3e8ead65e0597c6118af089f731a57cd57633aa6"
      },
      "decision": "accept_for_diagnostic_use",
      "limitationCount": 1,
      "metrics": {
        "reviewedCaseCount": 1,
        "acceptedCaseCount": 1,
        "rejectedCaseCount": 0,
        "limitedCaseCount": 1,
        "machineReviewedCount": 1,
        "humanReviewedCount": 0
      }
    }
  ],
  "subjectReports": [
    {
      "subjectPack": "math-answer",
      "caseCount": 1,
      "metrics": {
        "reviewedCaseCount": 1,
        "acceptedCaseCount": 1,
        "rejectedCaseCount": 0,
        "limitedCaseCount": 1,
        "machineReviewedCount": 1,
        "humanReviewedCount": 0
      }
    },
    {
      "subjectPack": "junior-physics-answer",
      "caseCount": 2,
      "metrics": {
        "reviewedCaseCount": 2,
        "acceptedCaseCount": 2,
        "rejectedCaseCount": 0,
        "limitedCaseCount": 2,
        "machineReviewedCount": 2,
        "humanReviewedCount": 0
      }
    },
    {
      "subjectPack": "senior-physics-answer",
      "caseCount": 1,
      "metrics": {
        "reviewedCaseCount": 1,
        "acceptedCaseCount": 1,
        "rejectedCaseCount": 0,
        "limitedCaseCount": 1,
        "machineReviewedCount": 1,
        "humanReviewedCount": 0
      }
    }
  ],
  "totals": {
    "reviewedCaseCount": 4,
    "acceptedCaseCount": 4,
    "rejectedCaseCount": 0,
    "limitedCaseCount": 4,
    "machineReviewedCount": 4,
    "humanReviewedCount": 0
  },
  "reviewPolicySha256": "024cf3cc2970ee9b2fa7c4e966404ecfbee16257d4a33489898e0764fde82fa6",
  "dispositions": {
    "reviewStatus": "completed",
    "equivalencePolicy": "synthetic_fixture_equivalent",
    "acceptanceScope": "synthetic_fixture_diagnostic",
    "humanIdentityDisposition": "not_claimed",
    "deliveryTrustDisposition": "not_projected",
    "wpfDisposition": "not_integrated",
    "liveAcceptanceDisposition": "not_accepted",
    "controlsDisposition": "not_verified",
    "eligible": false,
    "optimizationCandidateRefs": []
  },
  "engineProvenance": {
    "engineKind": "deterministic_review_compiler",
    "engineId": "visual-machine-review",
    "engineVersion": "1.0.0",
    "interpreter": {
      "implementation": "CPython",
      "version": "3.13.7"
    },
    "liveProvider": false,
    "cloudEgress": false
  },
  "generatedAt": "2026-07-29T06:10:00Z"
}
